{
  "schemaVersion": "1.0",
  "defaultProfile": "codex-default",
  "profiles": {
    "codex-default": {
      "adapter": "codex-cli",
      "model": null
    }
  },
  "roleBindings": {
    "backend-developer": "codex-default",
    "frontend-developer": "codex-default",
    "code-reviewer": "codex-default"
  }
}
